{
  "specversion": "1.0",
  "id": "b41d7e09-8c25-4a6b-91f3-0d5e2a7c8b16",
  "source": "/magalu/logistica/portal-entregadores",
  "type": "br.com.magalu.logistica.driver.updated.v1",
  "time": "2026-08-03T09:41:22.083Z",
  "subject": "3c9a7e14-52b8-4d6f-8a03-e71f9b2c5d48",
  "sequence": "4",
  "sequencetype": "Integer",
  "partitionkey": "3c9a7e14-52b8-4d6f-8a03-e71f9b2c5d48",
  "traceparent": "00-9c1e5a7b3d2f48c6b0a9e8d7c6b5a4f3-1a2b3c4d5e6f7081-01",
  "dataclassification": "internal",
  "datacontenttype": "application/json",
  "dataschema": "https://schemas.magalu.com.br/logistica/driver-sync/v1/driver.updated.schema.json",
  "data": {
    "changed_fields": ["/vehicle/type", "/vehicle/cargo_capacity_kg", "/delivery_radius_km"],
    "driver": {
      "driver_id": "3c9a7e14-52b8-4d6f-8a03-e71f9b2c5d48",
      "status": "active",
      "document_type": "cnpj",
      "document_token": "tok_9Hn2QpVx4LrT8mKdZbW3aYcE",
      "vehicle": {
        "type": "car",
        "plate_token": "tok_M3kQw8ZpN5xTvB2rLcHy7JdF",
        "cargo_capacity_kg": 220
      },
      "delivery_radius_km": 25,
      "operating_area": {
        "ibge_city_code": "3550308",
        "uf": "SP"
      },
      "segments": ["goods"],
      "compliance": {
        "background_check": "approved",
        "documents_valid_until": "2027-05-30",
        "approved_at": "2026-08-03T06:02:55.771Z"
      },
      "created_at": "2026-08-03T02:14:07.418Z",
      "updated_at": "2026-08-03T09:41:21.994Z"
    }
  }
}
